{
  "$schema": "./schemas/recipes.schema.json",
  "version": "1.0.0",
  "extractedFrom": "phase1-aks-automatic-grounding.md Section 5.2 (R1-R17) + Phase 1.6 simulation findings (R18+ + named patterns)",
  "extractedAt": "2026-04-28",
  "promotionPolicy": "promotion_candidate: true means recipe appears in 5+ sims and may be worth promoting to a first-class rich component in Phase 3 (vs composing from primitives every time).",
  "recipes": [
    {
      "id": "R1",
      "name": "Plan summary card",
      "intent": "Single-card plan summary for floor-case (single-container, single-deployable)",
      "composition": "Card[Text(h2)+Text(body)+List+Row[Button × 2]]",
      "components_used": ["Card", "Text", "List", "Row", "Button"],
      "fires_when": ["track:containerized_web with single service AND no existing manifests"],
      "anti_patterns": ["use R2 if ≥2 distinct concepts (cost, preview, identity wiring)"],
      "validated_by_sims": ["sim-01", "sim-06", "sim-10", "sim-11"],
      "provenance": "extracted",
      "promotion_candidate": false
    },
    {
      "id": "R2",
      "name": "Multi-card plan",
      "intent": "Multiple sibling Cards in a Column when plan has >5 distinct concepts that benefit from independent objection",
      "composition": "Column[Card(plan)+Card(invisible-work)+Card(cost)+Row[Button × N]]",
      "components_used": ["Column", "Card", "Text", "List", "Row", "Button"],
      "fires_when": ["multi-service web", "agentic app with multiple integration points", "greenfield architecture proposal", "migration with multiple phases"],
      "anti_patterns": ["use R1 if simple single-deployable", "do NOT collapse into one mega-card — defeats the independent-objection model"],
      "validated_by_sims": ["sim-02", "sim-03", "sim-05", "sim-06", "sim-10", "sim-11"],
      "provenance": "extracted",
      "promotion_candidate": true
    },
    {
      "id": "R2.1",
      "name": "Multi-card with hierarchical inner content",
      "intent": "Each Card in R2 column gets defined inner structure with 2-3 group headers and visual separators",
      "composition": "Card[Text(h2)+Group(IN-CLUSTER WORKLOADS)+Group(MANAGED AZURE RESOURCES)+Group(PLATFORM)] using ╭─...─╮ framing + ▸ markers + ★ for highlights",
      "components_used": ["Card", "Text", "List", "Divider"],
      "fires_when": ["R2 inner Card has >5 items"],
      "anti_patterns": ["flat inner List for >5 items reads as a wall"],
      "validated_by_sims": ["sim-05"],
      "provenance": "proposed",
      "promotion_candidate": false
    },
    {
      "id": "R3",
      "name": "Migration mapping table (PaaS source → Azure equivalent)",
      "intent": "Mental-model bridge for PaaS migrants — opening surface BEFORE any plan card",
      "composition": "Card[Text(h2 source→target headline)+Table[from_source|to_azure|why_this_thing]+Text(small, citation)]",
      "components_used": ["Card", "Text", "Table"],
      "fires_when": ["intent:paas_migration with named source (render, heroku, vercel, fly, netlify, railway)"],
      "anti_patterns": ["do NOT emit plan card before R3 — bridges mental model first"],
      "validated_by_sims": ["sim-02", "sim-10", "sim-11"],
      "provenance": "extracted",
      "promotion_candidate": false
    },
    {
      "id": "R4",
      "name": "Per-item cards in Column with bulk + per-item actions",
      "intent": "Multiple per-app cards plus master 'approve all N' affordance for bulk scenarios",
      "composition": "Column[Text(h2)+Card(item-1)+Card(item-2)+...+Card(rollup)+Row[Button(approve-all)+Button(one-at-a-time)]]",
      "components_used": ["Column", "Card", "Text", "Row", "Button"],
      "fires_when": ["bulk mode with ≥2 distinct items needing per-item plans"],
      "anti_patterns": ["force user through serial 1-by-1 review when bulk is the intent"],
      "validated_by_sims": ["sim-11"],
      "provenance": "extracted",
      "promotion_candidate": false
    },
    {
      "id": "R5",
      "name": "Diff plan (additive, with markers)",
      "intent": "Show what's preserved/added/modified/deleted before any file write",
      "composition": "Card[Text(h2)+List with leading '+ '/'  '/'- '/'~ ' markers per line + Text(annotation column)+Row[Button(approve)]]",
      "components_used": ["Card", "Text", "List", "Row", "Button"],
      "fires_when": ["existing files in scope (existing manifests, existing GHA workflows, iteration mode)"],
      "anti_patterns": ["overwrite without showing diff first", "merge unchanged + changed in same list without markers"],
      "validated_by_sims": ["sim-02", "sim-05", "sim-07", "sim-08", "sim-09", "sim-11"],
      "provenance": "extracted",
      "promotion_candidate": true,
      "notes": "Marker set: + (new file), ~ (modified, with line-count delta), - (deleted), space (unchanged). The ~ marker was surfaced by sim-09."
    },
    {
      "id": "R6",
      "name": "Why this stack (rationale card)",
      "intent": "Greenfield architecture rationale — why each major decision was made",
      "composition": "Card[Text(h3)+List of one-line reasons tied to user's situation]",
      "components_used": ["Card", "Text", "List"],
      "fires_when": ["greenfield architecture proposal", "user asks 'why X?'"],
      "anti_patterns": ["abstract general reasons (use Microsoft Learn doc page instead) — must be tied to user's specific situation"],
      "validated_by_sims": ["sim-06", "sim-10"],
      "provenance": "extracted",
      "promotion_candidate": false
    },
    {
      "id": "R7",
      "name": "What I'm doing for you (reassurance list)",
      "intent": "Surface invisible work the system handles when user is M1/M2 (no infra expertise)",
      "composition": "Card[Text(h3, 'What I'm doing for you')+List of specific items tied to user's artifacts]",
      "components_used": ["Card", "Text", "List"],
      "fires_when": ["persona is M1/M2/M3", "user said 'I don't really do K8s' / 'just deploy this'"],
      "anti_patterns": ["generic items like 'setting up your cluster' — must be specific to user's actual files / services / inferred dependencies (validated sim-03 S3)"],
      "validated_by_sims": ["sim-01", "sim-02", "sim-03", "sim-05", "sim-06", "sim-09", "sim-10"],
      "provenance": "extracted",
      "promotion_candidate": true
    },
    {
      "id": "R7-table-variant",
      "name": "What each artifact does FOR you (3-column comparison)",
      "intent": "When user pushes back on the visible weight of files AND has named a comparator product, show 3-column: File / What X did invisibly / What this file buys you",
      "composition": "Card[Text(h3)+Table[File|What_comparator_did|What_this_file_buys_you]+Text(small)]",
      "components_used": ["Card", "Text", "Table"],
      "fires_when": ["user pushed back on file count AND named comparator (Vercel, Heroku, Render)"],
      "anti_patterns": ["abstract comparison without naming the user's actual files"],
      "validated_by_sims": ["sim-01"],
      "provenance": "proposed",
      "promotion_candidate": false
    },
    {
      "id": "R8",
      "name": "Job-to-be-done table (you want / how)",
      "intent": "When user names a competing product OR pushes on cost, parse JTBD and address each — without recommending the named product back",
      "composition": "Card[Text(h2 'Same outcome — let me reshape')+Table[You_want|How_AKS_Automatic_does_it_honest]+Row[Button(reshape)+Button(stay)+Button(honest_exit)]]",
      "components_used": ["Card", "Text", "Table", "Row", "Button"],
      "fires_when": ["user named Container Apps / App Service / Functions / non-Azure compute", "user pushed back on cost"],
      "anti_patterns": ["recommend the named alternative back (violates Section 6.6)", "lead with 'Here's why AKS Automatic is better than X' — frame as reshape, not defense"],
      "validated_by_sims": ["sim-01", "sim-08", "sim-10"],
      "provenance": "extracted",
      "promotion_candidate": false
    },
    {
      "id": "R9",
      "name": "Review pack composition",
      "intent": "Package multi-file review pack for human SRE/ops reviewer",
      "composition": "Column[Card(contents-with-✨/⚙ provenance tags)+Card(delivery-options Row[Button × N])]",
      "components_used": ["Column", "Card", "Text", "List", "Row", "Button"],
      "fires_when": ["intent:handover to human reviewer", "user said 'package up for review' / 'SRE review' / 'send to <name>'"],
      "anti_patterns": ["dump file list (curate reading order)", "single-channel delivery (offer PR / Slack / ZIP / link / terminal)"],
      "validated_by_sims": ["sim-12"],
      "provenance": "extracted",
      "promotion_candidate": false
    },
    {
      "id": "R9.1",
      "name": "File-preview Card (sub-pattern of R9)",
      "intent": "Preview a generated file with first ~10-12 lines + 'see full file' affordance, optionally with per-line annotations",
      "composition": "Card[Text(h3, 'filename (preview)')+CodeBlock(first ~10-12 lines)+Text(small, 'see full file →')] OR Card[Table[line|content|annotation]] for annotated previews",
      "components_used": ["Card", "Text", "CodeBlock", "Table"],
      "fires_when": ["any 'show me what you generated' flow", "review-pack delivery", "before approval of large diff"],
      "anti_patterns": ["dump full file inline (D1 — codesmith output goes to surfaces)"],
      "validated_by_sims": ["sim-12"],
      "provenance": "proposed",
      "promotion_candidate": false
    },
    {
      "id": "R10",
      "name": "Single grounded question with citation",
      "intent": "Single-question RadioGroup or prose question with source citation; replaces multi-field Questionnaire when only one ambiguity matters",
      "composition": "Card[Text(p reflection)+Text(p grounding)+RadioGroup[option × N]+Text(small, 'Source: <tool/skill citation>')]",
      "components_used": ["Card", "Text", "RadioGroup"],
      "fires_when": ["exactly one ambiguity remains AND it can be enumerated as 2-5 options"],